{"a": 0, "c": 1, "code": "MDA12", "description": "\u00dcbernahme von elektronischen Informationstr\u00e4gern (Festplatten, Disketten, Speicherkassetten, USB-Schl\u00fcssel, ZIP-Disketten, externen Festplatten usw.) oder von Papier (Listen, unvollst\u00e4ndige Textausgaben, Nachrichten usw.), die zum Recycling bestimmt sind", "i": 0, "label": "\u00dcbernahme recycelter oder ausgemusterter datentr\u00e4ger", "language": "DE", "theme": "Infragestellung von Informationen", "uuid": "b402d5c9-4576-11e9-9173-0800277f0571"}