{"a": 1, "c": 0, "code": "MDA25", "description": "Gebrek aan beheersing van het systeem waardoor iedere upgrade of evolutie onmogelijk wordt", "i": 0, "label": "Aantasting van de onderhoudbaarheid van het informatiesysteem", "language": "NL", "theme": "Technische mankementen", "uuid": "b402d60a-4576-11e9-9173-0800277f0571"}