{"a": 1, "c": 1, "code": "MD14", "description": "Personne se faisant passer pour une autre de mani\u00e8re \u00e0 utiliser ces privil\u00e8ges d'acc\u00e8s au syst\u00e8me d'information, d\u00e9sinformer le destinataire, r\u00e9aliser une fraude\u2026", "i": 1, "label": "Usurpation de droits", "language": "FR", "theme": "Compromission des fonctions", "uuid": "b402d530-4576-11e9-9173-0800277f0571"}