{"a": 1, "c": 0, "code": "ME18", "description": "Tout \u00e9v\u00e8nement environnemental pouvant affecter physiquement les locaux de mani\u00e8re \u00e0 les rendre inutilisable.", "i": 1, "label": "Sinistre environnemental (Incendie, eau, poussi\u00e8re, salet\u00e9, etc.)", "language": "FR", "theme": "Sinistres physiques", "uuid": "b402d688-4576-11e9-9173-0800277f0571"}