{"a": 1, "c": 0, "code": "ME15", "description": "Perturbation, arr\u00eat ou mauvais dimensionnement des services de t\u00e9l\u00e9communication (t\u00e9l\u00e9phone, acc\u00e8s Internet, r\u00e9seau Internet).", "i": 0, "label": "Perte des moyens de t\u00e9l\u00e9communication", "language": "FR", "theme": "Perte de services essentiels", "uuid": "b402d668-4576-11e9-9173-0800277f0571"}