{"a": 0, "c": 0, "code": "MD23", "description": "Persoon die zich toegang verschaft tot de communicatiemiddelen van het informatiesysteem en die de overdracht van gegevens wijzigt (door onderschepping, inlassing, vernietiging ...) of een beroep doet op die toegangsmogelijkheden tot hij een geautoriseerde toegang vindt.", "i": 1, "label": "Wijziging van de gegevens", "language": "NL", "theme": "Onrechtmatige acties", "uuid": "b402d584-4576-11e9-9173-0800277f0571"}