{"a": 0, "c": 1, "code": "MD26", "description": "Personne effectuant un traitement d\u2019information non autoris\u00e9 par la l\u00e9gislation ou un r\u00e8glement.", "i": 1, "label": "Traitement illicite des donn\u00e9es", "language": "FR", "theme": "Actions illicites", "uuid": "b402d599-4576-11e9-9173-0800277f0571"}